{
  "schema_version": "0.2.0",
  "query_id": "query_exchange_contract_amount_01",
  "retrieval_method": "BM25",
  "corpus_snapshot_id": "corpus_04750795e1a2d5c3",
  "chunking_config_id": "doctype-hier-parent-child-table-dual.v0.2.0",
  "index_snapshot_id": "index_bm25_sample_v0_1",
  "applied_filters": {
    "corp_codes": ["00105855"],
    "document_ids": [],
    "doc_groups": ["exchange"],
    "doc_subtypes": ["단일판매공급계약체결"],
    "base_years": [],
    "base_months": [],
    "receipt_date_from": "2023-01-01",
    "receipt_date_to": "2023-12-31",
    "is_correction": true,
    "retrieval_eligible": true
  },
  "top_k": 10,
  "latency_ms": 4.2,
  "results": [
    {
      "rank": 1,
      "score": 8.42,
      "score_type": "BM25",
      "component_scores": {
        "bm25": 8.42,
        "dense": null,
        "rrf": null,
        "reranker": null
      },
      "document_id": "exchange_20230406800008",
      "chunk_id": "chunk_cbcb75e7adb0e72c6e687b2f",
      "chunk_type": "TABLE_ROW",
      "parent_chunk_id": "chunk_0f7cf403348d483021f07f69",
      "text_provenance": "DETERMINISTIC_LINEARIZATION",
      "citation_authority": "SOURCE_SPANS",
      "raw_text": "2. 계약내역 | 계약금액(원) | 106,316,336,069 | 106,316,336,069",
      "source_locator": "exchange_20230406800008/20230406800008.xml#node=3;row=2-2;col=0-3",
      "source_spans": [
        {
          "file_id": "file_c74070b5a9805436098e2fb1",
          "rel_path": "20230406800008.xml",
          "node_id": "exchange_20230406800008::20230406800008.xml::n3",
          "order_index": 3,
          "row_start": 2,
          "row_end": 2,
          "col_start": 0,
          "col_end": 3,
          "source_locator": "exchange_20230406800008/20230406800008.xml#node=3;row=2-2;col=0-3"
        }
      ]
    }
  ]
}
